{
  "project": "Base Server Project Keypoints",
  "description": "Complete guidelines for building projects following the base_server template pattern",
  "version": "1.0.0",
  "sections": [
    {
      "id": 1,
      "name": "Configuration Management",
      "keypoints": [
        {
          "id": "1.1",
          "name": "config.json as Central Hub",
          "summary": "All server configuration should be defined in a single config.json file rather than hardcoding values throughout the application.",
          "description": "The `config.json` file is the single source of truth for all server configuration. Every route, external dependency, and port setting is defined here, eliminating hardcoded values. This approach ensures that the server can be deployed across different environments by simply changing the configuration file."
        },
        {
          "id": "1.2",
          "name": "Configuration Structure",
          "summary": "The config.json file must include run_details, external_dependencies, and api_details sections with specific nested properties.",
          "description": "The `config.json` must follow this structure:\n```json\n{\n  \"run_details\": {\n    \"root_port\": 8000,\n    \"local_storage_folder\": \"./storage\",\n    \"pid_file\": \"./storage/server.pid\",\n    \"docker_image\": \"my-server:latest\",\n    \"port_offsets\": {\n      \"dashboard\": 0,\n      \"api\": 1\n    }\n  },\n  \"external_dependencies\": {},\n  \"api_details\": {\n    \"routes\": {}\n  }\n}\n```"
        },
        {
          "id": "1.3",
          "name": "Port Offset System",
          "summary": "Services are accessed through a root_port plus configurable offsets (e.g., root_port 8000 for dashboard, 8001 for API).",
          "description": "Ports are managed through the `root_port` and `port_offsets` mechanism. The root_port (e.g., 8000) serves the dashboard, and offset ports serve other services. Adding 1 to root_port gives the API port (8001). This allows multiple services to coexist without port conflicts."
        },
        {
          "id": "1.4",
          "name": "Route Definition in Configuration",
          "summary": "Every API route must be explicitly registered in config.json with its HTTP method, function name, file path, inputs, and expected outputs.",
          "description": "Each route must be explicitly defined in `config.json` under `api_details.routes`. This includes the HTTP method, function name, file path, input parameters, and expected output structure. The Flask application automatically imports and registers these routes at startup."
        },
        {
          "id": "1.5",
          "name": "Environment Variables and .env",
          "summary": "Sensitive credentials like API keys must be stored in a .env file that is added to .gitignore to prevent accidental exposure.",
          "description": "Sensitive information like API keys and passwords must be stored in a `.env` file that is never committed to version control. The application loads these at runtime. Add `.env` to `.gitignore` to prevent accidental credential exposure."
        }
      ]
    },
    {
      "id": 2,
      "name": "BIST (Built-In Self Test) System",
      "keypoints": [
        {
          "id": "2.1",
          "name": "What is BIST?",
          "summary": "BIST is an automated testing framework that validates all endpoints, external dependencies, and dashboard pages are functional on server startup.",
          "description": "BIST is an automated testing framework that runs on server startup. It validates that all configured endpoints are functional, external dependencies are accessible, and the dashboard is operational. Results are saved to `results/bist_results.json` for inspection."
        },
        {
          "id": "2.2",
          "name": "BIST Execution Flow",
          "summary": "BIST runs automatically after the server starts, testing each endpoint defined in config.json and verifying external API connectivity.",
          "description": "When the server starts via `start.sh`, after the Docker container is running, BIST tests execute automatically. The tests probe each endpoint defined in `config.json`, verify external API connectivity, and check that all dashboard pages render correctly."
        },
        {
          "id": "2.3",
          "name": "BIST Test Results",
          "summary": "Test results are saved to results/bist_results.json containing endpoint status, response codes, success/failure flags, and dependency connectivity.",
          "description": "Test results are stored in `results/bist_results.json` with the following information:\n- Endpoint name and route\n- HTTP method used\n- Response status code\n- Response body\n- Test pass/fail status\n- Timestamp\n- External dependency connectivity status"
        },
        {
          "id": "2.4",
          "name": "Testing External Dependencies",
          "summary": "Each external API defined in config.json is tested to verify it's reachable and properly authenticated during BIST execution.",
          "description": "Each external API dependency defined in `config.json` under `external_dependencies` is tested during BIST. The system verifies that API endpoints are reachable and that any required authentication works before marking the dependency as healthy."
        },
        {
          "id": "2.5",
          "name": "Dashboard Page Validation",
          "summary": "BIST validates that all required dashboard pages exist and render without errors before marking the server as healthy.",
          "description": "The BIST framework validates that all dashboard pages (main.html, events.html, api_docs.html, etc.) exist and render without errors. If a required page is missing or has syntax errors, the test will flag it as failed."
        }
      ]
    },
    {
      "id": 3,
      "name": "Lifecycle Management (start.sh and stop.sh)",
      "keypoints": [
        {
          "id": "3.1",
          "name": "start.sh: Server Startup Process",
          "summary": "The start.sh script reads configuration, checks ports, builds the Docker image, runs the container, saves the PID, and executes BIST tests.",
          "description": "The `start.sh` script automates the entire startup process:\n1. Reads configuration from `config.json`\n2. Checks if the server is already running and stops it if necessary\n3. Verifies that required ports are available\n4. Builds the Docker image\n5. Runs the Docker container with proper port mapping and volume mounting\n6. Saves the container PID\n7. Runs BIST tests\n8. Displays the dashboard and API URLs"
        },
        {
          "id": "3.2",
          "name": "Port Configuration in start.sh",
          "summary": "The script dynamically extracts root_port and port_offsets from config.json to map container ports to the configured host ports.",
          "description": "The script extracts `root_port`, `port_offsets`, and `docker_image` from `config.json`. It maps the container's internal port 8000 to the configured root_port, and port 8001 (dashboard + 1) to root_port + 1. This allows changing server ports without modifying the script."
        },
        {
          "id": "3.3",
          "name": "Docker Integration",
          "summary": "The start.sh script builds a Docker image and runs it as a container with proper port mapping and volume mounting for persistent storage.",
          "description": "The `start.sh` script builds a Docker image using the `Dockerfile`, then runs it as a container. Volumes are mounted to persist storage data. The script ensures proper networking by mapping the internal container ports to the configured host ports."
        },
        {
          "id": "3.4",
          "name": "Health Checking",
          "summary": "After startup, the script waits for the container to initialize, retrieves its PID, and saves it for monitoring and shutdown purposes.",
          "description": "Before marking the server as started, `start.sh` waits 3 seconds for the container to initialize, then retrieves its PID and saves it to the file specified in `config.json`. This PID is used for monitoring and stopping the server."
        },
        {
          "id": "3.5",
          "name": "stop.sh: Server Shutdown Process",
          "summary": "The stop.sh script reads the PID file, stops and removes the Docker container, and cleans up related files.",
          "description": "The `stop.sh` script:\n1. Reads the PID file from `config.json` path\n2. Reads the container name from the Docker image name\n3. Stops the Docker container\n4. Removes the container\n5. Cleans up the PID file\n6. Verifies the port is freed before returning"
        },
        {
          "id": "3.6",
          "name": "Graceful Shutdown",
          "summary": "The shutdown process cleanly stops the container before removal, allowing for any necessary cleanup operations.",
          "description": "The shutdown process is designed to be graceful. The container is stopped cleanly (allowing for any necessary cleanup), then removed. If shutdown fails, the script reports an error and the PID file remains so the user is aware a process might still be running."
        }
      ]
    },
    {
      "id": 4,
      "name": "Pages and Dashboard Structure",
      "keypoints": [
        {
          "id": "4.1",
          "name": "Three-Page Dashboard System",
          "summary": "The server includes main.html for status, events.html for request logs, and api_docs.html for interactive API documentation.",
          "description": "The server includes three built-in dashboard pages accessible at `/ui/`:\n1. **main.html** - Server status, port information, configuration display\n2. **events.html** - Last 100 request/response logs with full details\n3. **api_docs.html** - Interactive API documentation with request builder"
        },
        {
          "id": "4.2",
          "name": "Dashboard Route Registration",